Title,Director,Cast,Genre,Music,year,language,industry
Bettada Thayi,Perala,"Srinath, Aarathi, Vajramuni",,Satyam,1986,Kannada,Sandalwood
Bhagyada Lakshmi Baramma,Singeetham Srinivasa Rao,"Rajkumar, Madhavi, K. S. Ashwath, Balakrishna, Thoogudeepa Srinivas",,Singeetham Srinivasa Rao,1986,Kannada,Sandalwood
Brahmastra,Perala,"Ambarish, Lakshmi, Vajramuni, Mukhyamantri Chandru",,Satyam,1986,Kannada,Sandalwood
Ee Jeeva Ninagagi,V. Somashekhar,"Vishnuvardhan, Urvashi, Baby Shalini, Lokanath",,Vijay Anand,1986,Kannada,Sandalwood
Ella Hengasarinda,B. Subba Rao,"Rajesh, Jai Jagadish, Ramakrishna, Bharathi Vishnuvardhan, Tara, Padma Vasanthi, Bhavya",,Krishna Chakra,1986,Kannada,Sandalwood
Guri,P. Vasu,"Rajkumar, Archana, Tara, Pandari Bai, Jai Jagadish",,Rajan–Nagendra,1986,Kannada,Sandalwood
Henne Ningenu Bandhana,Ravindranath,"Charan Raj, Thulasi, Mukhyamantri Chandru, Pandari Bai",,Hamsalekha,1986,Kannada,Sandalwood
Hennina Koogu,Dorai-Bhagwan,"Sridhar, Saritha, Tara, K. S. Ashwath",,M. Ranga Rao,1986,Kannada,Sandalwood
Hosa Neeru,K. V. Jayaram,"Ananth Nag, Suhasini, Lokanath",,G. K. Venkatesh,1986,Kannada,Sandalwood
Karna,H. R. Bhargava,"Vishnuvardhan, Sumalatha, K. S. Ashwath, Sumithra",,M. Ranga Rao,1986,Kannada,Sandalwood
Kathanayaka,P. Vasu,"Vishnuvardhan, Sumalatha, Leelavathi, Vajramuni, Srinivasa Murthy",,M. Ranga Rao,1986,Kannada,Sandalwood
Kedi No.1,Kommineni Seshagiri Rao,"Tiger Prabhakar, Viji, Dheerendra Gopal, Leelavathi",,Satyam,1986,Kannada,Sandalwood
Krishna Nee Begane Baro,H. R. Bhargava,"Vishnuvardhan, Bhavya, Kim, Mukhyamantri Chandru",,Bappi Lahiri,1986,Kannada,Sandalwood
Lancha Lancha Lancha,Ravindranath,"Lokesh, Jayanthi, Mahalakshmi, Jai Jagadish, Sundar Raj",,Kalyan – Venkatesh,1986,Kannada,Sandalwood
Madhura Bandhavya,Amrutham,"Ambarish, Geetha, Jai Jagadish, Tara",,M. Ranga Rao,1986,Kannada,Sandalwood
Madhavacharya,G. V. Iyer,"Poorna Prasad, Ravindra, Shrivatsa, Vinaya Prasad",,M. Balamuralikrishna,1986,Kannada,Sandalwood
Madhuve Madu Tamashe Nodu,Sathya,"Vishnuvardhan, Aarathi, Dwarakish, Jai Jagadish, Mahalakshmi,",,Vijay Anand,1986,Kannada,Sandalwood
Malaya Marutha,Lalitha Ravi,"Vishnuvardhan, Madhavi, Saritha, Shivaram, Dinesh",,Vijaya Bhaskar,1986,Kannada,Sandalwood
Maneye Manthralaya,H. R. Bhargava,"Ananth Nag, Bharathi, Ramesh Aravind, Jai Jagadish, Tara, Umashree",,M. Ranga Rao,1986,Kannada,Sandalwood
Marjala,B Vijay Gujjar,"Vijay Kashi, Pallavi, Padma Vasanthi, Lohithaswa",,K. J. Joy,1986,Kannada,Sandalwood
Mouna Geethe,Geethapriya,"Srinath, Saritha, Sridhar, Sai Kumar",,M. Ranga Rao,1986,Kannada,Sandalwood
Mrugaalaya,V. Somashekhar,"Ambarish, Geetha, Sudheer",,Rajan–Nagendra,1986,Kannada,Sandalwood
Na Ninna Preetisuve,Somu – Shankar,"Arjun Sarja, V. Ravichandran, Bhavya, M. P. Shankar",,Shankar–Ganesh,1986,Kannada,Sandalwood
Namma Oora Devathe,Renuka Sharma,"Charan Raj, Bharathi, Vinod Alva, Bhavya",,Satyam,1986,Kannada,Sandalwood
Nannavaru,Bhagawan Sarang,"Srinath, Lakshmi, Dinesh, Ramakrishna",,M. Ranga Rao,1986,Kannada,Sandalwood
Nenapina Doni,T. S. Nagabharana,"Ananth Nag, Girish Karnad, Geetha, Roopadevi",,Vijaya Bhaskar,1986,Kannada,Sandalwood
Pithamaha,K. S. L. Swamy,"V. Ravichandran, Vijayalakshmi Singh, Rajesh",,M. Ranga Rao,1986,Kannada,Sandalwood
Preethi,A. T. Raghu,"Ambarish, Bhavya, Gayatri",,G. K. Venkatesh,1986,Kannada,Sandalwood
Prema Gange,Gururaju,"Murali, Bhavya, Vijay Kashi, Doddanna",,Rajan–Nagendra,1986,Kannada,Sandalwood
Prema Jala,Joe Simon,"Ananth Nag, Mahalakshmi, Seetharam, Shivaram",,M. Ranga Rao,1986,Kannada,Sandalwood
Rasthe Raja,Leela Vara Prasad,"Shankar Nag, Gayatri, Jayanthi",,Satyam,1986,Kannada,Sandalwood
Ratha Sapthami,M. S. Rajashekar,"Shivarajkumar, Asha Rani, Parvatha Vani, Doddanna",,Upendra Kumar,1986,Kannada,Sandalwood
Samsarada Guttu,Raghava,"Shankar Nag, Mahalakshmi, Tara, Sundar Raj",,Satyam,1986,Kannada,Sandalwood
Sathkara,Renuka Sharma,"Ambarish, Ambika, Vajramuni, Thoogudeepa Srinivas",,Satyam,1986,Kannada,Sandalwood
Satya Jyothi,K. Rangaraj,"Vishnuvardhan, Urvashi, Balakrishna",,Ilaiyaraaja,1986,Kannada,Sandalwood
Sedina Sanchu,T. S. Nagabharana,"Rajesh, Bhavya, Ramakrishna Hegde, Mukhyamantri Chandru",,Satyam,1986,Kannada,Sandalwood
Shankha Nada,Umesh Kulkarni,"Ramesh Bhat, Abhinaya, Arvind, Honnayya",,C. Ashwath,1986,Kannada,Sandalwood
Sundara Swapnagalu,K. Balachander,"Sridhar, Ramesh Aravind, Devilalitha, Tara, Janani, Kuyili",,Vijaya Bhaskar,1986,Kannada,Sandalwood
Thayiye Nanna Devaru,Vijay,"Shankar Nag, Tiger Prabhakar, Jayanthi, Pallavi, Mukhyamantri Chandru",,Satyam,1986,Kannada,Sandalwood
Tiger,Raviraja,"Tiger Prabhakar, Aarathi, Ramakrishna, Mahalakshmi",,Shankar–Ganesh,1986,Kannada,Sandalwood
Usha,Raghava,"Kalyan Kumar, Suhasini, Jayanthi",,Rajan–Nagendra,1986,Kannada,Sandalwood
Vishwaroopa,V. Somashekhar,"Ambarish, Geetha, Vajramuni",,Rajan–Nagendra,1986,Kannada,Sandalwood
Aaganthuka,Suresh Heblikar,"Suresh Heblikar, Vanitha Vasu, Devaraj, Jayashri",,Rajiv Taranath,1987,Kannada,Sandalwood
Aapadbandhava,A. T. Raghu,"Ambarish, Ambika, Parijatha, Lohithaswa",,Rajan–Nagendra,1987,Kannada,Sandalwood
Aase,Jayarama Reddy,"Charan Raj, Geetha, N. S. Rao, Disco Shanti",,Ravi Shenoy,1987,Kannada,Sandalwood
Aaseya Bale,Raj Kishor,"Vishnuvardhan, Nalini, Jai Jagadish, Loknath",,Vijaya Bhaskar,1987,Kannada,Sandalwood
Agni Kanye,T Janardhan,"Raja, Jai Jagadish, Ranjini, Dinesh",,Shankar–Ganesh,1987,Kannada,Sandalwood
Anthima Ghatta,Janakiram,"Shankar Nag, Urvashi, Tara, Ramesh Bhat",,Vijaya Bhaskar,1987,Kannada,Sandalwood
Anthima Theerpu,A. T. Raghu,"Ambarish, Bharathi, Geetha, Thoogudeepa Srinivas",,Hamsalekha,1987,Kannada,Sandalwood
Athiratha Maharatha,Perala,"Ananth Nag, Tiger Prabhakar, Ambika, Avinash",,K. Chakravarthy,1987,Kannada,Sandalwood
Avasthe,Krishna Masadi,"Ananth Nag, Archana, B. V. Karanth, M. P. Prakash, J. H. Patel",,Vijaya Bhaskar,1987,Kannada,Sandalwood
Baala Nouke,Shantaram Kanagal,"Srinivasa Murthy, Roopadevi, Tara",,K. P. Sukhadev,1987,Kannada,Sandalwood
Bandha Muktha,K. V. Raju,"Tiger Prabhakar, Bharathi, Devaraj, Ramakrishna",,Vijaya Bhaskar,1987,Kannada,Sandalwood
Bazar Bheema,Perala,"Ambarish, Geetha, Ambika, K. S. Ashwath",,Satyam,1987,Kannada,Sandalwood
Bedi,V. Somashekhar,"Ambarish, Bhavya, Sudha Chandran, Tiger Prabhakar",,Hamsalekha,1987,Kannada,Sandalwood
Bhadrakali,Renuka Sharma,"Sridhar, Mahalakshmi, Tara",,Satyam,1987,Kannada,Sandalwood
Daivashakti,Renuka Sharma,"Ananth Nag, Bhavya, Thoogudeepa Srinivas, Umashree",,Hamsalekha,1987,Kannada,Sandalwood
Dance Raja Dance,Dwarakish,"Vinod Raj, Devaraj, Divya, Sangeetha, Srinath",,Vijay Anand,1987,Kannada,Sandalwood
Digvijaya,Soma,"Ambarish, Shankar Nag, Ambika, Radha, Srinath, Vajramuni",,Hamsalekha,1987,Kannada,Sandalwood
Ee Bandha Anubandha,K. Janakiram,"Shankar Nag, Zarina Wahab, Master Manjunath, Vajramuni",,Ramesh Naidu,1987,Kannada,Sandalwood
Hosa Madam,S. Anand,"Mukhyamantri Chandru, Bharathi, Sundar Raj, Lohitashwa",,S. P. Kumar,1987,Kannada,Sandalwood
Hrudaya Pallavi,R. N. Jayagopal,"Srinath, Geetha, Pavithra, Ramakrishna",,M. Ranga Rao,1987,Kannada,Sandalwood
Huli Hebbuli,Vijay,"Shankar Nag, Tiger Prabhakar, Sumalatha, Bhavya, Ananth Nag, Leelavathi",,Vijaya Bhaskar,1987,Kannada,Sandalwood
Inspector Krantikumar,A. T. Raghu,"Ambarish, Geetha, Bhavya, Jai Jagadish, Mukhyamantri Chandru",,Rajan–Nagendra,1987,Kannada,Sandalwood
Jayasimha,P. Vasu,"Vishnuvardhan, Mahalakshmi, Vajramuni, Umashree",,Vijay Anand,1987,Kannada,Sandalwood
Jeevana Jyothi,P. Vasu,"Vishnuvardhan, Ambika, Nalini",,Vijay Anand,1987,Kannada,Sandalwood
Karunamayi,H. R. Bhargava,"Vishnuvardhan, Bhavya, Tara, Pandari Bai, K. S. Ashwath",,Rajan–Nagendra,1987,Kannada,Sandalwood
Kendada Male,B. C. Gowrishankar,"Devaraj, Nagesh Kashyap, Sundar Krishna Urs, Chandralekha",,L. Vaidyanathan,1987,Kannada,Sandalwood
Kurukshetra,H. R. Bhargava,"Ananth Nag, Saritha, Bhavya, Charan Raj, Doddanna",,M. Ranga Rao,1987,Kannada,Sandalwood
Manamecchida Hudugi,M.S.Rajshekar,"Shivarajkumar, Sudharani, Sundar Krishna Urs",,Upendra Kumar,1987,Kannada,Sandalwood
Manasa Veene,Geethapriya,"Sridhar, Srinath, Saritha",,M. Ranga Rao,1987,Kannada,Sandalwood
Mr. Raaja,V. Somashekhar,"Ambarish, Mahalakshmi, Tara, Mukhyamantri Chandru",,Hamsalekha,1987,Kannada,Sandalwood
Mukhavada,M. D. Kaushik,"Ramakrishna, Tara, Jayanthi, Loknath",,K. P. Sukhdev,1987,Kannada,Sandalwood
Nyaayakke Shikshe,Srinivas,"Sridhar, Bharathi, Ambika, Charan Raj",,Vijay Anand,1987,Kannada,Sandalwood
Olavina Udugore,Rajendra Babu,"Ambarish, Manjula Sharma, Ramakrishna, N. S. Rao",,M. Ranga Rao,1987,Kannada,Sandalwood
Onde Goodina Hakkigalu,Rajachandra,"Tiger Prabhakar, Lakshmi, Shubha, Vikram",,Vijay Anand,1987,Kannada,Sandalwood
Ondu Muttina Kathe,Shankar Nag,"Rajkumar, Archana, Mukhyamantri Chandru, Doddanna, Shivaram",,L. Vaidyanathan,1987,Kannada,Sandalwood
Poornachandra,C. V. Rajendran,"Ambarish, Ambika, Srinath",,G. K. Venkatesh,1987,Kannada,Sandalwood
Premaloka,V. Ravichandran,"V. Ravichandran, Juhi Chawla, Leelavathi, Mukhyamantri Chandru",,Hamsalekha,1987,Kannada,Sandalwood
Pushpak,Singeetham Srinivasa Rao,"Kamal Haasan, Amala, Tinnu Anand, Amjad Khan, Prathap Pothan",,L. Vaidyanathan,1987,Kannada,Sandalwood
Ravana Rajya,T. S. Nagabharana,"Devaraj, Bhavya, Tara",,Vijay Anand,1987,Kannada,Sandalwood
Sampradaya,Master Hirannayya,"Master Hirannayya, Bharathi, Seetharam",,P. Vajrappa,1987,Kannada,Sandalwood
Sangrama,K. V. Raju,"Ravichandran, Bhavya, Lokesh, Loknath",,Hamsalekha,1987,Kannada,Sandalwood
Sathwa Pareekshe,Srinivas,"Tiger Prabhakar, Bhavya, Sridhar, Jayachitra",,Vijay Anand,1987,Kannada,Sandalwood
Sathyam Shivam Sundaram,K. S. R. Das,"Vishnuvardhan, Sumithra, Raadhika, Vajramuni",,K. Chakravarthy,1987,Kannada,Sandalwood
Shivabhakta Markandeya,B. S. Ranga,"Rajesh, Roopa Devi, Padma Vasanthi",,M. Ranga Rao,1987,Kannada,Sandalwood
Shruthi Seridaaga,Chi. Dattaraj,"Rajkumar, Madhavi, Geetha, Balakrishna",,T. G. Lingappa,1987,Kannada,Sandalwood
Shubha Milana,H. R. Bhargava,"Vishnuvardhan, Ambika, Uday, K. S. Ashwath",,M. Ranga Rao,1987,Kannada,Sandalwood
Sowbhagya Lakshmi,H. R. Bhargava,"Vishnuvardhan, Lakshmi, Radha, Ramesh Bhat",,S. P. Balasubramanyam,1987,Kannada,Sandalwood
Sri Chamundeshwari Pooja Mahime,B V Srinivas,"Ramakrishna, Rohini, Vajramuni",,Vijaya Krishnamurthy,1987,Kannada,Sandalwood
Surya,Baraguru Ramachandrappa,"Lokesh, Rohini Hattangadi, Manu (Kannada actor)|Maanu, Pramila Joshai",,Vijaya Bhaskar,1987,Kannada,Sandalwood
Thaliya Aane,D. Rajendra Babu,"Tiger Prabhakar, Bharathi, Vinod Alva, Manjula Sharma",,Vijaya Bhaskar,1987,Kannada,Sandalwood
Thayi,Perala,"Ananth Nag, Shankar Nag, Bhavya, Gayathri, Tara",,Satyam,1987,Kannada,Sandalwood
Thayi Kotta Thali,Ravindranath,"Murali, Mahalakshmi, Lokesh, Jayanthi",,M. Ranga Rao,1987,Kannada,Sandalwood
Vijay,Jayanthi,"Rajashekar, Kim, Jai Jagadish, Sundar Krishna Urs, Jayamalini",,M. Ranga Rao,1987,Kannada,Sandalwood
Yaarigagi,Pradeep Kumar,"Ramakrishna, Sridhar, Vijay Kashi, Varnalatha, Leelavathi",,G. K. Venkatesh,1987,Kannada,Sandalwood
Aasphota,T. S. Nagabharana,"Sridhar, Triveni, H. G. Dattatreya",,C. Ashwath,1988,Kannada,Sandalwood
Anjada Gandu,Renuka Sharma,"V. Ravichandran, Khushbu, Srinivasa Murthy, Devaraj, Master Manjunath, Umashri",,Hamsalekha,1988,Kannada,Sandalwood
Arjun,A. T. Raghu,"Ambarish, Geetha, Kalyan Kumar, Devaraj, Mukhyamantri Chandru",,Rajan–Nagendra,1988,Kannada,Sandalwood
Avale Nanna Hendthi,K. PrabhakarS. Umesh,"Kashinath, Bhavya, Tara, Mukhyamantri Chandru, N. S. Rao",,Hamsalekha,1988,Kannada,Sandalwood
Balondu Bhavageethe,Geethapriya,"Ananth Nag, Srinath, Saritha, Ramesh Bhat",,Hamsalekha,1988,Kannada,Sandalwood
Bannada Vesha,Girish Kasaravalli,"Sridhar, Charuhasan, Nalina Murthy",,L. Vaidyanathan,1988,Kannada,Sandalwood
Bharath,Joe Simon,"Tiger Prabhakar, Jayanthi, Abhinaya, Mukhyamantri Chandru",,Shankar–Ganesh,1988,Kannada,Sandalwood
Bhoomi Thayane,Raj Kishor,"Vinod Alva, Chi Guru Dutt, Bhavya, Jaggesh",,Vijaya Bhaskar,1988,Kannada,Sandalwood
Brahma Vishnu Maheshwara,Rajachandra,"Ambarish, V. Ravichandran, Ananth Nag, Kiran Juneja, Thulasi, Mahalakshmi",,Vijay Anand,1988,Kannada,Sandalwood
Chiranjeevi Sudhakar,Singeetham Srinivasa Rao,"Raghavendra Rajkumar, Monisha Unni, Kanchana, Balaraj, Vanitha Vasu",,Upendra Kumar,1988,Kannada,Sandalwood
Daada,P. Vasu,"Vishnuvardhan, Geetha, Sangeetha, Suparna, Devaraj",,Vijay Anand,1988,Kannada,Sandalwood
December 31,Manobala,"Vishnuvardhan, Urvashi, Jai Jagadish, Pavithra",,Satyam,1988,Kannada,Sandalwood
Devatha Manushya,Singeetham Srinivasa Rao,"Rajkumar, Geetha, Sudharani. K. S. Ashwath",,Upendra Kumar,1988,Kannada,Sandalwood
Dharma Patni,M.S.Rajshekar,"Vinod Alva, Tara, Lakshmi",,Hamsalekha,1988,Kannada,Sandalwood
Dharmathma,A. Jagannathan,"Shankar Nag, Ambika, Tiger Prabhakar, Ramakrishna",,Rajan–Nagendra,1988,Kannada,Sandalwood
Elu Suttina Kote,B. C. Gowrishankar,"Ambarish, Gouthami, Ramesh Aravind, Devaraj",,L. Vaidyanathan,1988,Kannada,Sandalwood
Ganda Mane Makkalu,T P Gajendra,"Srinath, Vanisri, Dwarakish, Ramesh Aravind, Sudharani",,Vijayanand,1988,Kannada,Sandalwood
Gudugu Sidilu,Shankar Nayyar,"Jai Jagadish, Ramakrishna, Geetha, Anuradha, Vajramuni",,Vijaya Bhaskar,1988,Kannada,Sandalwood
Jana Nayaka,H. R. Bhargava,"Vishnuvardhan, Bhavya, Devaraj, Doddanna, Mukhyamantri Chandru",,Rajan–Nagendra,1988,Kannada,Sandalwood
Kadina Benki,Suresh Heblikar,"Suresh Heblikar, Vanitha Vasu, Mamta Rao, Girish Karnad",,Vijaya Bhaskar,1988,Kannada,Sandalwood
Kampana,Vemagal Jagannath Rao,"Tiger Prabhakar, Pavithra, Sharath Babu, Tara",,L. Vaidyanathan,1988,Kannada,Sandalwood
Kankana Bhagya,Perala,"Ramakrishna, Jeevitha, Shivakumar, Anand",,Krishna - Chakra,1988,Kannada,Sandalwood
Kote,Baraguru Ramachandrappa,"Tara, Sundar Raj, Maanu, Pramila Joshai",,Chandrashekhara Kambara,1988,Kannada,Sandalwood
Krishna Rukmini,H. R. Bhargava,"Vishnuvardhan, Ramya Krishna, Devaraj, Mukhyamantri Chandru, Umashree",,K. V. Mahadevan,1988,Kannada,Sandalwood
Kirathaka,V. Somashekhar,"Tiger Prabhakar, Ambika, Vajramuni",,Hamsalekha,1988,Kannada,Sandalwood
Mahadasohi Sharana Basava,Shankaralinga Sugnalli,"Srinivasa Murthy, Thriveni, K. S. Ashwath, Seetharam, Vaishali Kasaravalli",,K. P. Sukhadev,1988,Kannada,Sandalwood
Matrudevobhava,N. S. Dhananjaya,"Jai Jagadish, Ramakrishna, Srinivasa Murthy, Jayanthi, Mahalakshmi, Tara",,Hamsalekha,1988,Kannada,Sandalwood
Matru Vatsalya,H. N. Shankar,"Tiger Prabhakar, Srinath, Lakshmi",,Shankar–Ganesh,1988,Kannada,Sandalwood
Meenakshi Mane Meshtru,T. N. Narasimhan,"Devaraj, Tara, Raghunandan, Kalpana Reddy",,S. P. Venkatesh,1988,Kannada,Sandalwood
Mithileya Seetheyaru,Lalitha Ravee,"Geetha, Akhila Thandur, B. V. Radha, Kalpana Iyer, Shankar Nag, Vishnuvardhan, Kashinath",,Vijaya Bhaskar,1988,Kannada,Sandalwood
Mutthaide,Renuka Sharma,"Ananth Nag, Bhavya, Tara, Ramakrishna, Mukhyamantri Chandru",,M. Ranga Rao,1988,Kannada,Sandalwood
Nammoora Raja,H. R. Bhargava,"Vishnuvardhan, Rajesh, Manjula Sharma, Jai Jagadish",,Rajan–Nagendra,1988,Kannada,Sandalwood
Nanna Avesha,Jaganmohan Rao,"Lakshmi, Sundar Krishna Urs, Ramakrishna Hegde",,Satyam,1988,Kannada,Sandalwood
Nava Bharatha,K. V. Raju,"Ambarish, Mahalakshmi, Devaraj, Doddanna",,K. Chakravarthy,1988,Kannada,Sandalwood
Nee Nanna Daiva,Sundaranath Suvarna,"Tiger Prabhakar, Mahalakshmi, Jayanthi, Sangeetha, Vajramuni, Devaraj",,Shankar–Ganesh,1988,Kannada,Sandalwood
New Delhi,Joshi,"Ambarish, Suresh Gopi, Sumalatha, Urvashi, Paresh Rawal, Thyagarajan, C. R. Simha",,Shyam,1988,Kannada,Sandalwood
Olavina Aasare,K. V. Jayaram,"Vishnuvardhan, Rupini, Sudha Chandran",,M. Ranga Rao,1988,Kannada,Sandalwood
Oorigitta Kolli,Kallesh,"Kalyan Kumar, Sudha Chandran, Vijayaraj, Balakrishna",,M. Ranga Rao,1988,Kannada,Sandalwood
Praja Prabhuthva,D. Rajendra Babu,"Ambarish, Mahalakshmi, Mukhyamantri Chandru, Umashree, Vajramuni",,Shankar–Ganesh,1988,Kannada,Sandalwood
Prema Tapaswi,H. Ramesh,"Pramod Chakravarthy, Mohan, Abhinaya",,Hamsalekha,1988,Kannada,Sandalwood
Ramanna Shamanna,B. Subba Rao,"Ambarish, V. Ravichandran, Madhavi, Geetha, Devaraj, Umashree",,S. P. Balasubramanyam,1988,Kannada,Sandalwood
Ranadheera,V. Ravichandran,"V. Ravichandran, Khushbu, Ananth Nag, Jayachitra, Lokesh, Jaggesh, Jai Jagadish",,Hamsalekha,1988,Kannada,Sandalwood
Ranaranga,V. Somashekhar,"Shivarajkumar, Sudharani, Tara, Master Manjunath, Dheerendra Gopal, C. R. Simha",,Hamsalekha,1988,Kannada,Sandalwood
Sahasa Veera,Om Sai Prakash,"Vinod Alva, Gouthami, Ramakrishna, Aparna",,Satyam,1988,Kannada,Sandalwood
Sambhavami Yuge Yuge,Siddalingaiah,"Murali, Sudharani, Padma Kumta, Dheerendra Gopal",,Rajan–Nagendra,1988,Kannada,Sandalwood
Samyuktha,K. N. Chandrashekar Sharma,"Shivarajkumar, Veena, Balaraj, Chi Guru Dutt, Avinash",,Singeetham Srinivasa Rao,1988,Kannada,Sandalwood
Sangliyana,P. Nanjundappa,"Shankar Nag, Ambarish, Bhavya, Tara, Devaraj, Vajramuni, Master Manjunath",,Hamsalekha,1988,Kannada,Sandalwood
Shakthi,Tiger Prabhakar,"Tiger Prabhakar, Shankar Nag, Sharath Babu, Ramya Krishna, Vanitha Vasu",,K. Chakravarthy,1988,Kannada,Sandalwood
Shanthi Nivasa,H. R. Bhargava,"Ananth Nag, Bharathi, Vijay Kashi, Ramesh Bhat",,M. Ranga Rao,1988,Kannada,Sandalwood
Shiva Mecchida Kannappa,Vijay,"Shivarajkumar, Master Puneeth, Geetha, Saraladevi",,T. G. Lingappa,1988,Kannada,Sandalwood
Sri Venkateshwara Mahime,Anil Baindur,"Ananth Nag, Saritha, Pandari Bai, Somayajulu",,M. S. Viswanathan,1988,Kannada,Sandalwood
Suprabhatha,Dinesh Babu,"Vishnuvardhan, Suhasini, Srividya, Manu (Kannada actor)|Maanu",,Rajan–Nagendra,1988,Kannada,Sandalwood
Tabarana Kathe,Girish Kasaravalli,"Charuhasan, Nalina Murthy, Madhava Rao, Ha Sa Kru",,L. Vaidyanathan,1988,Kannada,Sandalwood
Thayi Karulu,N. S. Dhananjaya,"Srinivasa Murthy, Jayanthi, Vinod Alva, Jai Jagadish, Tara, Vanitha Vasu",,Satyam,1988,Kannada,Sandalwood
Thayigobba Karna,Raj Kishor,"Ambarish, Sumalatha, Jai Jagadish, Tara",,Vijaya Bhaskar,1988,Kannada,Sandalwood
Thayiya Aase,Raj Kishor,"Rajesh, Pramila Joshai, Bhavya, Vinod Alva",,Vijaya Bhaskar,1988,Kannada,Sandalwood
Vijaya Khadga,V. Somashekar,"Ambarish, Srinath, Ambika, M. P. Shankar",,Hamsalekha,1988,Kannada,Sandalwood
Abhimana,P. N. Srinivas,"P. N. Srinivas, Gayathri, K. S. Ashwath, Leelavathi",,M. Ranga Rao,1989,Kannada,Sandalwood
Ade Raaga Ade Haadu,M. S. Rajashekar,"Shivarajkumar, Seema, Srinath, Thoogudeepa Srinivas",,Shankar–Ganesh,1989,Kannada,Sandalwood
Adhrushta Rekhe,Renuka Sharma,"Kashinath, Amrutha, Sudhir, Doddanna",,Shankar–Ganesh,1989,Kannada,Sandalwood
Amaanusha,N. R. Nanjunde Gowda,"Ananth Nag, Bhavya, Kavya, Devaraj",,Hamsalekha,1989,Kannada,Sandalwood
Ananthana Avathara,Kashinath,"Kashinath, Anjali Sudhakar, Kavitha, Dinesh",,Hamsalekha,1989,Kannada,Sandalwood
Ananthara,Anwar Thavarekere,"Srinath, Geetha, Vanitha Vasu, Jai Jagadish",,Guna Singh,1989,Kannada,Sandalwood
Anthintha Gandu Nanalla,Srinivas,"Ambarish, Shankar Nag, Nishanthi, Sridhar, Tara",,Vijay Anand,1989,Kannada,Sandalwood
Avane Nanna Ganda,K. Prabhakar,"Kashinath, Sudharani, Vanitha Vasu, Sudhir, Doddanna",,Hamsalekha,1989,Kannada,Sandalwood
Avathara Purusha,Raj Kishore,"Ambarish, Sumalatha, Tara, Jai Jagadish",,Vijay Anand,1989,Kannada,Sandalwood
Bala Hombale,M. S. Rajashekar,"Rajesh, Suman Ranganathan, Vinod Alva, Ramesh Bhat",,Upendra Kumar,1989,Kannada,Sandalwood
Bangarada Baduku,B. S. Ranga,"Tiger Prabhakar, Lakshmi, M. P. Shankar, Nagesh, Master Manjunath",,Shankar–Ganesh,1989,Kannada,Sandalwood
Bidisada Bandha,Tiger Prabhakar,"Tiger Prabhakar, Sujatha, Tara, Ramakrishna, Vijay Kashi, Abhinaya",,M. Ranga Rao,1989,Kannada,Sandalwood
Bisilu Beladingalu,Kodlu Ramakrishna,"Sridhar, Sudha Chandran, Padma Vasanthi, Balakrishna",,M. Ranga Rao,1989,Kannada,Sandalwood
C.B.I. Shankar,P. Nanjundappa,"Shankar Nag, Suman Ranganathan, Tara, Shashikumar, Devaraj, Vajramuni",,Hamsalekha,1989,Kannada,Sandalwood
Deva,Vijay,"Vishnuvardhan, Rupini, Devaraj, Tara, Balakrishna",,Upendra Kumar,1989,Kannada,Sandalwood
Doctor Krishna,Phani Ramachandra,"Vishnuvardhan, Suman Ranganathan, Tara, Leelavathi, Ramesh Bhat",,Rajan–Nagendra,1989,Kannada,Sandalwood
En Swamy Aliyandire,Jayanthi,"Tiger Prabhakar, Jayanthi, Tara, Rajashekar, Rajalakshmi",,Shankar–Ganesh,1989,Kannada,Sandalwood
Gagana,Dorai Bhagwan,"Ananth Nag, Khushbu, Mahalakshmi, Srinath, Vanitha Vasu, Leelavathi",,Rajan–Nagendra,1989,Kannada,Sandalwood
Gajapathi Garvabhanga,M. S. Rajashekar,"Raghavendra Rajkumar, Malashri, Srinath, Dheerendra Gopal, Abhinaya",,Upendra Kumar,1989,Kannada,Sandalwood
Gandandre Gandu,V. Somashekhar,"Ambarish, Nalini, Jai Jagadish, Thoogudeepa Srinivas",,G. K. Venkatesh,1989,Kannada,Sandalwood
Guru,Srikanth Nahatha,"Ambarish, Srinath, B. Saroja Devi, Neetha Puri, Thoogudeepa Srinivas",,Bappi Lahiri,1989,Kannada,Sandalwood
Hendthighelbedi,Dinesh Baboo,"Ananth Nag, Mahalakshmi, Tara, Devaraj",,Vijay Anand,1989,Kannada,Sandalwood
Hongkongnalli Agent Amar,Joe Simon,"Ambarish, Ambika, Umashree, Vajramuni, K. S. Ashwath",,Peter J. Kamilose,1989,Kannada,Sandalwood
Hosa Kavya,Sivachandran,"Tiger Prabhakar, Lakshmi, Aishwarya, Vinod Alva, Ramesh Bhat",,Shankar–Ganesh,1989,Kannada,Sandalwood
Hrudaya Geethe,H. R. Bhargava,"Vishnuvardhan, Bhavya, Khushbu, Devaraj, Sridhar, Umashree",,Rajan–Nagendra,1989,Kannada,Sandalwood
Idu Saadhya,Dinesh Baboo,"Shankar Nag, Ananth Nag, Tiger Prabhakar, Srinath, Ramesh Aravind, Revathi, Mahalakshmi, Disco Shanti",,Vijay Anand,1989,Kannada,Sandalwood
Indrajith,K. V. Raju,"Ambarish, Deepika, Devaraj, Shashikumar, Doddanna",,Hamsalekha,1989,Kannada,Sandalwood
Inspector Vikram,Dinesh Baboo,"Shivarajkumar, Kavya, Sundar Krishna Urs, K. S. Ashwath, Chi Guru Dutt",,Vijay Anand,1989,Kannada,Sandalwood
Jai Karnataka,Dwarakish,"Ambarish, Rajani, Mukhyamantri Chandru",,Vijay Anand,1989,Kannada,Sandalwood
Jayabheri,Mudduraj,"Shankar Nag, Ambarish, Bhavya, Vanitha Vasu, Rajesh",,Shankar–Ganesh,1989,Kannada,Sandalwood
Jacky,B. Subba Rao,"Ambarish, Geetha, Mahalakshmi, Devaraj, Ramesh Bhat, Lokanath",,S. P. Balasubrahmanyam,1989,Kannada,Sandalwood
Kindari Jogi,V. Ravichandran,"V. Ravichandran, Juhi Chawla, Lokesh, Thoogudeepa Srinivas, Doddanna, Mukhyamantri Chandru, Abhinaya, Master Manjunath, Sundar Raj",,Hamsalekha,1989,Kannada,Sandalwood
Krishna Nee Kunidaga,Dwarakish,"Vinod Raj, Sudharani, Jaggesh, Nachiketha, M. S. Umesh, Hema Chowdhary",,Vijay Anand,1989,Kannada,Sandalwood
Love Maadi Nodu,A. Subramanyam,"Kashinath, Sridhar, Srilatha, Master Manjunath",,L. Vaidyanathan,1989,Kannada,Sandalwood
Madhuri,K. V. Jayaram,"Vinod Alva, Geetha, Loknath, Dattathreya",,Sangeetha Raja,1989,Kannada,Sandalwood
Maha Yuddha,M. D. Kaushik,"Shankar Nag, Anjali",,Shankar–Ganesh,1989,Kannada,Sandalwood
Mane,Girish Kasaravalli,"Naseeruddin Shah, Deepti Naval, Rohini, Mico Chandru",,L. Vaidyanathan,1989,Kannada,Sandalwood
Manmatha Raja,Om Sai Prakash,"Kashinath, Sudharani, Jaggesh, Srinivasa Murthy",,K. Chakravarthy,1989,Kannada,Sandalwood
Muthinanta Manushya,Om Sai Prakash,"Tiger Prabhakar, Bharathi, Vajramuni, Mukhyamantri Chandru, Abhinaya",,K. Chakravarthy,1989,Kannada,Sandalwood
Namma Bhoomi,Thiagarajan,"Tiger Prabhakar, Nalini, Charan Raj, Ilavarasi",,Ilaiyaraaja,1989,Kannada,Sandalwood
Nanjundi Kalyana,M. S. Rajashekar,"Raghavendra Rajkumar, Malashri, Lokesh, Thoogudeepa Srinivas",,Upendra Kumar,1989,Kannada,Sandalwood
Narasimha,Om Sai Prakash,"Shankar Nag, Sudha Rani, Chandrika",,Hamsalekha,1989,Kannada,Sandalwood
Nyayakkagi Naanu,A. T. Raghu,"Ambarish, Sumalatha, Srinath, Jayanthi",,Satyam,1989,Kannada,Sandalwood
Ondagi Balu,K. S. R. Das,"Vishnuvardhan, Manjula Sharma, Avinash, Pandari Bai, Umashree",,Vijay Anand,1989,Kannada,Sandalwood
Onti Salaga,V. Somashekhar,"Ambarish, Khushbu, Jai Jagadish, Tiger Prabhakar, Vajramuni",,Hamsalekha,1989,Kannada,Sandalwood
Padmavyuha,A. T. Raghu,"Tiger Prabhakar, Murali, Srinath, Manjula Sharma, Tara, Mahalakshmi",,Yuvaraj,1989,Kannada,Sandalwood
Parashuram,V. Somashekhar,"Rajkumar, Vani Viswanath, Mahalakshmi, Puneeth Rajkumar, Thoogudeepa Srinivas, C. R. Simha",,Hamsalekha,1989,Kannada,Sandalwood
Poli Huduga,S. S. Ravichandra,"V. Ravichandran, Jaggesh, Karishma, Tara, Devaraj",,Hamsalekha,1989,Kannada,Sandalwood
Premagni,T. S. Nagabharana,"Arjun Sarja, Khushbu, Shashikumar, Tara",,Hamsalekha,1989,Kannada,Sandalwood
Preyasi Preethisu,Mallesh,"Kashinath, Sagarika, Dinesh, Janaki",,L. Vaidyanathan,1989,Kannada,Sandalwood
Raja Yuvaraja,Raj Kishore,"Ambarish, Sumalatha, Tara, Tiger Prabhakar, Jaggesh",,Vijay Anand,1989,Kannada,Sandalwood
Rajasimha,Joe Simon,"Shankar Nag, Bhavya",,M. Ranga Rao,1989,Kannada,Sandalwood
Rudra,K. S. R. Das,"Vishnuvardhan, Khushbu, Vajramuni, Doddanna, K. S. Ashwath",,Amar,1989,Kannada,Sandalwood
Samsara Nouke,D. Rajendra Babu,"Ambarish, Geetha, Pandari Bai, Mahalakshmi, Balakrishna",,M. Ranga Rao,1989,Kannada,Sandalwood
Sankranthi,N. R. Nanjunde Gowda,"Lokesh, Saritha, Sundar Raj, C. R. Simha",,L. Vaidyanathan,1989,Kannada,Sandalwood
Sharavegada Saradara,K. V. Jayaram,"Kumar Bangarappa, Ashwini Bhave, Asha Parekh, C. R. Simha",,Sangeetha Raja,1989,Kannada,Sandalwood
Singari Bangari,Chandrahasa Alva,"Kashinath, Vinod Alva, Kavya, Jayarekha",,Hamsalekha,1989,Kannada,Sandalwood
Sura Sundaranga,Kashinath,"Kashinath, Abhinaya, Vanitha Vasu",,Hamsalekha,1989,Kannada,Sandalwood
Tarka,Sunil Kumar Desai,"Shankar Nag, Vanitha Vasu, Devaraj, Avinash",,Guna Singh,1989,Kannada,Sandalwood
Thayigobba Tharle Maga,Om Sai Prakash,"Kashinath, Chandrika, Jai Jagadish, Doddanna",,M. Ranga Rao,1989,Kannada,Sandalwood
Yuddha Kaanda,K. V. Raju,"V. Ravichandran, Poonam Dhillon, Shashikumar, Devaraj, Jaggesh, Master Manjunath",,Hamsalekha,1989,Kannada,Sandalwood
Yuga Purusha,D. Rajendra Babu,"V. Ravichandran, Khushbu, Moon Moon Sen, Ramakrishna, Mukhyamantri Chandru",,Hamsalekha,1989,Kannada,Sandalwood
Aasegobba Meesegobba,M. S. Rajashekar,"Shivarajkumar, Raghavendra Rajkumar, Sudharani, Shruti",,Upendra Kumar,1990,Kannada,Sandalwood
